{
  "$schema": "../schema/manifest.schema.json",
  "id": "ensenzu-app",
  "repository": "shiguri-01/ensenzu",
  "revision": "f1fbec776a393e7023c8fa8324ea26c0774752e5",
  "license": "Apache-2.0",
  "packages": [
    "app/src"
  ],
  "entryPoints": {
    "model": "Model",
    "message": "Msg",
    "update": "update",
    "view": "view"
  },
  "strategy": "effect-model",
  "effectPolicy": "record-download-command",
  "sourceSha256": "a580832dc58cd030ee22091abf58be8a1542c0696e57eae6f223d0e1c9bfd14b",
  "properties": [
    "active numeric fields reject non-finite input",
    "pending input and error are mutually exclusive",
    "invalid input preserves previous result",
    "advanced toggle preserves calculation",
    "download effect IDs remain unique",
    "rendered status matches validation state"
  ],
  "findingVisibility": "public-bug"
}
