{
  "$schema": "../schema/manifest.schema.json",
  "id": "mooncakes-official-ui",
  "repository": "moonbitlang/mooncakes.io",
  "revision": "f7877338598f6a13387b889dd912b15029a0ce5f",
  "license": "Apache-2.0",
  "packages": [
    "src/page/build_queue",
    "moonbitlang/website@a6222f7292ce50f2a08847ef0852b1a8d456a393:src/pages/rabbita-home/main",
    "moonbitlang/moonbit-docs@24f6b9a0b9ac997119ecd3069825edf65d3473fe:next/sources/fullstack-one-project/frontend"
  ],
  "entryPoints": {
    "model": "Model",
    "message": "Msg",
    "update": "update",
    "view": "view"
  },
  "strategy": "effect-model",
  "effectPolicy": "record-and-inject",
  "sourceSha256": "ace1fe509cb2135d18f96eb2274a148be6d7324046491b24d1fb0cd03cdf0581",
  "properties": [
    "older build responses do not replace newer Build Queue results",
    "tutorial replies match the current edited title",
    "Build Queue queue and recent statuses remain aligned",
    "official website indices remain in range",
    "pending request IDs remain unique",
    "rendered official UI state matches model"
  ],
  "findingVisibility": "public-bug"
}
